{
  "schemaVersion": "0.1.0",
  "eventId": "CC-SY-EV-MATERIAL-001",
  "recordVersion": "0.1.0",
  "streamId": "asset-draft:CC-AD-MATERIAL-DEMO-001",
  "sequence": 1,
  "assetDraftId": "CC-AD-MATERIAL-DEMO-001",
  "operationRef": "CC-SY-OP-MATERIAL-TITLE-001",
  "eventType": "operation-accepted",
  "actorId": "CC-CR-DEMO-MOLECULAR-001",
  "baseRevision": 0,
  "resultingRevision": 1,
  "idempotencyKey": "idem-material-title-20260714-001",
  "changedPaths": ["/title"],
  "reasonCodes": ["OPERATION-APPLIED"],
  "wardenDecisionRef": "CC-WD-MATERIAL-REVIEW-001",
  "recordedAt": "2026-07-14T11:11:02Z",
  "issuer": {
    "issuerId": "CC-SVC-SYNNERGYZE-EVENT-STORE",
    "name": "Synnergyze Asset Event Store",
    "authorityRef": "docs/integrations/synnergyze/CC-SYNNERGYZE-ASSET-DRAFT-API-V0.1.md"
  }
}
